{
  "contract": "contract-005.json",
  "exit_code": 0,
  "failing_line": null,
  "failing_step": null,
  "halt": null,
  "head": "01d880bc3176cdd8f31d72e67bb3eba54d634378",
  "id": "ev-007",
  "kind": "ev",
  "oracle": "oracle-003",
  "parent": "closure-006.json",
  "seq": 7,
  "session": {
    "exit_code": 0,
    "hard_cap": false,
    "log_sha256": "aaaaaaaaaaaaaaaaaaaaaaaaaaaaaaaaaaaaaaaaaaaaaaaaaaaaaaaaaaaaaaaa",
    "lost": false,
    "name": "impl-demo-0a1b-006"
  },
  "stage": "offline",
  "steps": [
    {
      "cmd": "guard:scope",
      "exit_code": 0,
      "id": "G3",
      "output_sha256": "aaaaaaaaaaaaaaaaaaaaaaaaaaaaaaaaaaaaaaaaaaaaaaaaaaaaaaaaaaaaaaaa"
    },
    {
      "cmd": "bash proofs/02_no_email.sh",
      "exit_code": 1,
      "id": "O1",
      "output_sha256": "bbbbbbbbbbbbbbbbbbbbbbbbbbbbbbbbbbbbbbbbbbbbbbbbbbbbbbbbbbbbbbbb"
    }
  ],
  "tripwires": []
}
